id,casa,cpf,nome_civil,nome_eleitoral,genero,uf.x,sg_partido,situacao,condicao_eleitoral,ultima_legislatura,em_exercicio,localizacao,uf.y,municipio_embargo,municipio,endereco,julgamento,infracao,data_insercao_lista
141417,camara,77548981872,ÉDIO VIEIRA LOPES,EDIO LOPES,M,RR,PL,Exercício,Titular,56,1,Fazenda São Carlos as margens da Br 174 - Zona Rural Rural do Município de Mucajai.,RR,Mucajaí,Boa Vista/RR,"Rua do Buritizeiro, 133",pendente de julgamento,Infração da Flora(Não Classificada-Móvel),03/04/2019
74419,camara,01960970453,LUIZ GONZAGA PATRIOTA,GONZAGA PATRIOTA,M,PE,PSB,Exercício,Titular,56,1,"Fazenda Serra Santa, Petrolina/PE",PE,Petrolina,Brasília/DF,"Sqn 302 - Bloco 'F', Aptº 402",13/09/2018,Infração da Flora(Não Classificada-Móvel),04/04/2017
74554,camara,04789113515,JOSÉ ALVES ROCHA,JOSÉ ROCHA,M,BA,PL,Exercício,Titular,56,1,"EMBARGO: FAZENDA SÃO LOURENÇO, CORIBE/BA",BA,Coribe,Salvador/BA,Av. Sete de Setembro Nº 1796 Apt. 501,pendente de julgamento,"Desmatar florestas ou demais formas de vegetação, sem autorização do Ibama.",14/03/2008
74478,camara,01818961415,LUCIANO CALDAS BIVAR,LUCIANO BIVAR,M,PE,PSL,Exercício,Titular,56,1,"FICA EMBARGADA TODA E QUALQUER ATIVIDADE DA MARINA TOQUINHO, LOCALIZADA NA PRAIA DE TOQUINHO, MUNICIPIO DE IPOJUCA/PE",PE,Jaboatão dos Guararapes,Jaboatão dos Guararapes/PE,"Av.Bernardo de Vieira de Melo, 1626, Aptº 1301",08/09/2016,"Promover construção em solo não edificável, ou no seu entorno, assim considerado em razão de seu valor paisagístico, ecológico, artístico, turístico, histórico, cultural, religioso, arqueológico, etnográfico ou monumental, sem autorização da autoridade competente ou em desacordo com a concedida.",08/08/2012
204449,camara,01862797870,NELSON NED PREVIDENTE,NELSON BARBUDO,M,MT,PSL,Exercício,Titular,56,1,"Fazenda Metinho. Ficam embargadas as atividades de aberturas de drenos e utilização da área mencionada no Auto de Infração n° 222035-D, até que seja providenciado o licenciamento ambiental. Coordenadas Lat17°44'82.3""S , Long 053°11'30""W",MT,Alto Taquari,Poloni/SP,"Rua Rui Barbosa, 243",19/08/2014,"Destruir (danificar, desmatar) florestas ou demais formas de vegetações consideradas de preservação permanente (áreas do art. 2º da Lei 4.771/65)",19/06/2019
